{
  "schema_version": "1.0",
  "report_id": "rep_disc_1792454710",
  "run_id": "discovery_run_42",
  "created_at": "2026-10-20T00:04:57.577664+00:00",
  "checkpoint_sha256": "sha256:94451cea469fa7c635f5e2efd8502f96fad6c9fd26461a42f1704bd6e495a885",
  "benchmark_manifest_sha256": "sha256:eb2a1ed1bfaf72933961cea1f86065744cf54430623b3b006247eb866264b172",
  "protocol": {
    "search_indices": [
      10,
      11,
      12,
      13,
      14,
      15,
      16,
      17,
      18,
      19
    ],
    "validation_indices": [
      0,
      1,
      2,
      3,
      4,
      5,
      6,
      7,
      8,
      9
    ],
    "unseen_indices": [
      20,
      21,
      22,
      23,
      24,
      25,
      26,
      27,
      28,
      29,
      30,
      31,
      32,
      33,
      34,
      35,
      36,
      37,
      38,
      39,
      40,
      41,
      42,
      43,
      44,
      45,
      46,
      47,
      48,
      49,
      50,
      51,
      52,
      53,
      54,
      55,
      56,
      57,
      58,
      59,
      60,
      61,
      62,
      63,
      64,
      65,
      66,
      67,
      68,
      69,
      70,
      71,
      72,
      73,
      74,
      75,
      76,
      77,
      78,
      79,
      80,
      81,
      82,
      83,
      84,
      85,
      86,
      87,
      88,
      89,
      90,
      91,
      92,
      93,
      94,
      95,
      96,
      97,
      98,
      99,
      100,
      101,
      102,
      103,
      104,
      105,
      106,
      107,
      108,
      109,
      110,
      111,
      112,
      113,
      114,
      115,
      116,
      117,
      118,
      119
    ],
    "distance_threshold": 0.8,
    "max_candidates": 50,
    "precision_digits": 500,
    "seed": 42,
    "definition_registry_sha256": "sha256:a9cf1949adbccd589a93c9da8b3a41d6c122f94cfb41f3132f89097a537c56c3",
    "protocol_id": "sha256:4a132e5150e2e13065ef9fb412ab1b6c88c8080381f0e051618ea241044ace72"
  },
  "claims": [
    {
      "schema_version": "1.0",
      "relation": {
        "relation_type": "POINTWISE_INTEGER_LINEAR_V1",
        "operands": [
          {
            "oeis_id": "A000217",
            "index_scale": 1,
            "index_shift": 0
          },
          {
            "oeis_id": "A100011",
            "index_scale": 1,
            "index_shift": 0
          },
          {
            "oeis_id": "A100022",
            "index_scale": 1,
            "index_shift": 0
          }
        ],
        "coefficients": [
          "2",
          "1",
          "-1"
        ],
        "canonical_expression": "(2)*A000217 + (1)*A100011 + (-1)*A100022 = 0",
        "claim_id": "sha256:a29cff84ae31c1ca4fc3e3ad14fd157eae2ea8b33b0c0e0b614e2c8625b268f1"
      },
      "status": "NUMERICALLY_VERIFIED_CONJECTURE",
      "latent_evidence": [
        {
          "candidate_id": "cand_048",
          "checkpoint_sha256": "sha256:94451cea469fa7c635f5e2efd8502f96fad6c9fd26461a42f1704bd6e495a885",
          "embedding_version": "tri_stream_strict_fp32",
          "vector_distance": 0.08046392314040422,
          "search_parameters": {
            "distance_threshold": 0.8
          },
          "seed": 42,
          "backend_versions": {
            "torch": "2.9.1+cpu"
          }
        }
      ],
      "numerical_evidence": {
        "outcome": "VERIFIED",
        "source_sha256": "sha256:a6ce4791307069b75e8cbd3af9e0d38065a468646b3ded60f3ec6cb69ebedbd0",
        "search_indices": [
          10,
          11,
          12,
          13,
          14,
          15,
          16,
          17,
          18,
          19
        ],
        "validation_indices": [
          0,
          1,
          2,
          3,
          4,
          5,
          6,
          7,
          8,
          9
        ],
        "unseen_indices": [
          20,
          21,
          22,
          23,
          24,
          25,
          26,
          27,
          28,
          29,
          30,
          31,
          32,
          33,
          34,
          35,
          36,
          37,
          38,
          39,
          40,
          41,
          42,
          43,
          44,
          45,
          46,
          47,
          48,
          49,
          50,
          51,
          52,
          53,
          54,
          55,
          56,
          57,
          58,
          59,
          60,
          61,
          62,
          63,
          64,
          65,
          66,
          67,
          68,
          69,
          70,
          71,
          72,
          73,
          74,
          75,
          76,
          77,
          78,
          79,
          80,
          81,
          82,
          83,
          84,
          85,
          86,
          87,
          88,
          89,
          90,
          91,
          92,
          93,
          94,
          95,
          96,
          97,
          98,
          99,
          100,
          101,
          102,
          103,
          104,
          105,
          106,
          107,
          108,
          109,
          110,
          111,
          112,
          113,
          114,
          115,
          116,
          117,
          118,
          119
        ],
        "coefficient_method": "EXACT_INTEGER_NULLSPACE",
        "pslq_precision_digits": null,
        "pslq_max_coefficient": null,
        "coefficients": [
          "2",
          "1",
          "-1"
        ],
        "validation_residuals": [
          "0",
          "0",
          "0",
          "0",
          "0",
          "0",
          "0",
          "0",
          "0",
          "0"
        ],
        "unseen_residuals": [
          "0",
          "0",
          "0",
          "0",
          "0",
          "0",
          "0",
          "0",
          "0",
          "0",
          "0",
          "0",
          "0",
          "0",
          "0",
          "0",
          "0",
          "0",
          "0",
          "0",
          "0",
          "0",
          "0",
          "0",
          "0",
          "0",
          "0",
          "0",
          "0",
          "0",
          "0",
          "0",
          "0",
          "0",
          "0",
          "0",
          "0",
          "0",
          "0",
          "0",
          "0",
          "0",
          "0",
          "0",
          "0",
          "0",
          "0",
          "0",
          "0",
          "0",
          "0",
          "0",
          "0",
          "0",
          "0",
          "0",
          "0",
          "0",
          "0",
          "0",
          "0",
          "0",
          "0",
          "0",
          "0",
          "0",
          "0",
          "0",
          "0",
          "0",
          "0",
          "0",
          "0",
          "0",
          "0",
          "0",
          "0",
          "0",
          "0",
          "0",
          "0",
          "0",
          "0",
          "0",
          "0",
          "0",
          "0",
          "0",
          "0",
          "0",
          "0",
          "0",
          "0",
          "0",
          "0",
          "0",
          "0",
          "0",
          "0",
          "0"
        ],
        "matrix_rank": 2,
        "matrix_nullity": 1,
        "minimal_support": null,
        "first_counterexample": null
      },
      "symbolic_evidence": {
        "outcome": "MISSING_DEFINITION",
        "independently_checked": false
      },
      "rejection": null,
      "status_history": [
        {
          "status": "LATENT_CANDIDATE",
          "created_at": "2026-10-20T00:04:57.577664+00:00",
          "evidence_type": "EMBEDDING_TRIPLE"
        },
        {
          "status": "NUMERICALLY_VERIFIED_CONJECTURE",
          "created_at": "2026-10-20T00:04:57.577664+00:00",
          "evidence_type": "EXACT_PARTITIONED_VALIDATION"
        }
      ]
    }
  ],
  "candidate_dispositions": [
    {
      "candidate_id": "cand_000",
      "disposition": "INSUFFICIENT_EVIDENCE",
      "claim_id": null,
      "reason_code": "NO_INTEGER_RELATION"
    },
    {
      "candidate_id": "cand_001",
      "disposition": "INSUFFICIENT_EVIDENCE",
      "claim_id": null,
      "reason_code": "NO_INTEGER_RELATION"
    },
    {
      "candidate_id": "cand_002",
      "disposition": "INSUFFICIENT_EVIDENCE",
      "claim_id": null,
      "reason_code": "NO_INTEGER_RELATION"
    },
    {
      "candidate_id": "cand_003",
      "disposition": "INSUFFICIENT_EVIDENCE",
      "claim_id": null,
      "reason_code": "NO_INTEGER_RELATION"
    },
    {
      "candidate_id": "cand_004",
      "disposition": "INSUFFICIENT_EVIDENCE",
      "claim_id": null,
      "reason_code": "NO_INTEGER_RELATION"
    },
    {
      "candidate_id": "cand_005",
      "disposition": "INSUFFICIENT_EVIDENCE",
      "claim_id": null,
      "reason_code": "NO_INTEGER_RELATION"
    },
    {
      "candidate_id": "cand_006",
      "disposition": "INSUFFICIENT_EVIDENCE",
      "claim_id": null,
      "reason_code": "NO_INTEGER_RELATION"
    },
    {
      "candidate_id": "cand_007",
      "disposition": "INSUFFICIENT_EVIDENCE",
      "claim_id": null,
      "reason_code": "NO_INTEGER_RELATION"
    },
    {
      "candidate_id": "cand_008",
      "disposition": "INSUFFICIENT_EVIDENCE",
      "claim_id": null,
      "reason_code": "NO_INTEGER_RELATION"
    },
    {
      "candidate_id": "cand_009",
      "disposition": "INSUFFICIENT_EVIDENCE",
      "claim_id": null,
      "reason_code": "NO_INTEGER_RELATION"
    },
    {
      "candidate_id": "cand_010",
      "disposition": "INSUFFICIENT_EVIDENCE",
      "claim_id": null,
      "reason_code": "NO_INTEGER_RELATION"
    },
    {
      "candidate_id": "cand_011",
      "disposition": "INSUFFICIENT_EVIDENCE",
      "claim_id": null,
      "reason_code": "NO_INTEGER_RELATION"
    },
    {
      "candidate_id": "cand_012",
      "disposition": "INSUFFICIENT_EVIDENCE",
      "claim_id": null,